26825,https://www.airbnb.com/rooms/26825,20190919050215,2019-09-19,Single Room whith private Bathroom,Nice and cozy roon for one person with a private bathroom only for you.,"Nice and cozy roon for one person with a private bathroom only for you. Air conditioning and heating. Situated in a quiet neighborhood with many restaurants and supermarkets. It's very near the Subway's Legazpi and Planetarium. Five minutes to the city center in subway. Near the Atocha's train station and bus.  If you come in summer you will cool in the community swimming pool.  It's very near the Museo del Prado, Thyssen Bornemisza, Reina Sofía and The Rastro. The apartment has 24 hour security. – Check in from 12 am  – Check out untill 11 am","Nice and cozy roon for one person with a private bathroom only for you. Nice and cozy roon for one person with a private bathroom only for you. Air conditioning and heating. Situated in a quiet neighborhood with many restaurants and supermarkets. It's very near the Subway's Legazpi and Planetarium. Five minutes to the city center in subway. Near the Atocha's train station and bus.  If you come in summer you will cool in the community swimming pool.  It's very near the Museo del Prado, Thyssen Bornemisza, Reina Sofía and The Rastro. The apartment has 24 hour security. – Check in from 12 am  – Check out untill 11 am – Smoking is prohibited in rooms and public areas. If you break this rule, it carries a penalty of 30€  – Forbidden to eat cooked food, or food and any drink that can stain or smell inside the room. I have a kitchen with dining room for this. - The kitchen is available to prepare coffee, tea or a sandwich, or to heat prepared food, but not to prepare lunch or dinner. Leave th",none,"Es un barrio muy tranquilo, en una zona de Madrid cerca del centro (15 minutos en Metro). Con bares, restaurantes y supermercados al lado. A cinco minutos del Matadero y Madrid Río y el Centro Comercial Plaza Río.","Airport to Apart. You can take a Taxi (30€) or public transport. If you arrive to terminal 4, you can take train or Metro. Terminal 1,2,3 only Metro. Train: Airport to Mendez Alvaro, them Mendez Alvaro (Metro Line 6) to Arganzuela Planetario. Metro: Airport to Nuevos Ministerios. Nuevos Ministerios to Arganzuela Planetario (Line 6).",Muy bien comunicado con dos Metros a cinco minutos (Líenea 3 y 6). De fácil aparcamiento por la zona.,"– Smoking is prohibited in rooms and public areas. If you break this rule, it carries a penalty of 30€  – Forbidden to eat cooked food, or food and any drink that can stain or smell inside the room. I have a kitchen with dining room for this. - The kitchen is available to prepare coffee, tea or a sandwich, or to heat prepared food, but not to prepare lunch or dinner. Leave the kitchen after eat clean & tidy, as you see.  – Upon arrival you are provided with a roll of toilet paper, when you finish, you should buy, because we are not a hotel or give service hotel. – The bathroom is not a spa, no 40min showers allowed. – You will have your own set of keys so that you are independent of us, but you care, you will lose, pay for a new key set. (50EUR). – The room is for the person who booking, do not invite others. – Please turn off the air conditioning when you leave the apartment.  – If you want to use the washing machine you must pay 5 €. Air Conditioner: 5€ day Optionally parking 10 € da","","For problems that I have lived with other guests, I am constrained to write my basic rules to be able to host you, they are simple and not very difficult to observe, but they are very important for me. One of the fundamentals is not to return drunks home. No smoking. No pets. Please leave the room in the same condition you found it. _Please keep the room and bathroom clean and tidy – Smoking is prohibited in rooms and public areas. If you break this rule, it carries a penalty of 30€  – Forbidden to eat cooked food, or food and any drink that can stain or smell inside the room. I have a kitchen with dining room for this. – The Access and use the kitchen is allowed to all guests the option to cook only for stays of 5 days onwards. Leave the kitchen after eat clean & tidy, as you see.  – Upon arrival you are provided with a roll of toilet paper, when you finish, you should buy, because we are not a hotel or give service hotel. – The bathroom is not a spa, no 40min showers allowed and It i",,,https://a0.muscache.com/im/pictures/149358/218d5b6b_original.jpg?aki_policy=large,,114340,https://www.airbnb.com/users/show/114340,Agustina,2010-04-27,"Madrid, Madrid, Spain","I like Fine art, Photography, Cinema, travel and music.
If you have any question please contact me",within an hour,100%,N/A,f,https://a0.muscache.com/im/users/114340/profile_pic/1272373168/original.jpg?aki_policy=profile_small,https://a0.muscache.com/im/users/114340/profile_pic/1272373168/original.jpg?aki_policy=profile_x_medium,Legazpi,1,1,"['email', 'phone', 'reviews', 'jumio', 'government_id']",t,t,"Madrid, Comunidad de Madrid, Spain",Legazpi,Legazpi,Arganzuela,Madrid,Comunidad de Madrid,28045,Madrid,"Madrid, Spain",ES,Spain,40.38985,-3.69011,t,House,Private room,1,1.0,1,1,Real Bed,"{Wifi,""Wheelchair accessible"",Doorman,Elevator,""Buzzer/wireless intercom"",Heating,Essentials,Shampoo,Hangers,""Hair dryer"",""translation missing: en.hosting_amenity_49"",""translation missing: en.hosting_amenity_50"",""Hot water"",""Bed linens"",""Dishes and silverware"",""Host greets you""}",,$25.00,,,,$15.00,1,$0.00,2,365,2,2,365,365,2.0,365.0,3 weeks ago,t,13,40,70,337,2019-09-19,136,27,2010-05-10,2019-07-10,94,10,10,10,10,10,10,t,,,f,f,strict_14_with_grace_period,f,f,1,0,1,0,1.19
30320,https://www.airbnb.com/rooms/30320,20190919050215,2019-09-19,Great Vacational Apartments,"","Fully furnished spacious apartments for rental in vacational the very center of Madrid city. Accommodated up to 2 people. - Fully equipped Kitchen with microwave, fridge, cooking utensils, pots pans, plates, glasses, coffee maker - with cable TV - Air conditioning and heating - Private bedroom (up to 2 bedrooms per apartment) - Private bathroom with bath tub or shower plate - Wi-fi - Hot Water - Dishwasher - Laundy machine - Within walking distance Everything: Sol, Gran Via, Fuencarral, etc. A great and welcoming place DURING your trip to Madrid. We will be delighted to Accommodated you. Sincerely, Iustin","Fully furnished spacious vacational apartments for rental in the very center of Madrid city. Accommodates up to 2 people. - Kitchen fully equipped with microwave, fridge, cooking utensils, pots pans, plates, glasses, coffee maker- TV with cable- Air conditioning and heating- Private bedroom ( up to 2 bedrooms per apartment )- Private bathroom with bath tub or shower plate- WI-fi- Hot water- Dishwasher- Laundy machine- Everything within walking distance: Sol, Gran Via, Fuencarral, etc.  A great and welcoming place during your trip to Madrid. We will be delighted to accommodate you. Sincerely, Iustina",none,"","","","","","",,,https://a0.muscache.com/im/pictures/336868/f67409fb_original.jpg?aki_policy=large,,130907,https://www.airbnb.com/users/show/130907,Dana,2010-05-24,"Madrid, Madrid, Spain","Apartasol offers a network of several spacious, comfortable apartments in the vibrant heart of Madrid.  The apartments are situated in three different locations, all very central and within walking distance from each other.  The sizes range from 35m 2 studios to 75m 2 two bedroom apartments and they can accommodate from 1 person up to 6 people depending on the type and size of the apartment.  Recently refurbished, the apartments are sure to preserve the traditional Madrileño look. Apartasol is well known for its extremely friendly staff and impeccable cleaning services",within an hour,100%,N/A,t,https://a0.muscache.com/im/users/130907/profile_pic/1373028590/original.jpg?aki_policy=profile_small,https://a0.muscache.com/im/users/130907/profile_pic/1373028590/original.jpg?aki_policy=profile_x_medium,Sol,3,3,"['email', 'phone', 'reviews']",t,f,"Madrid, Madrid, Spain",Sol,Sol,Centro,Madrid,Madrid,28012,Madrid,"Madrid, Spain",ES,Spain,40.41552,-3.70346,t,Apartment,Entire home/apt,2,1.0,1,2,Real Bed,"{TV,""Cable TV"",Wifi,""Air conditioning"",Kitchen,Elevator,Heating,""Family/kid friendly""}",,$65.00,$400.00,"$1,290.00",,,1,$18.00,5,180,5,5,180,180,5.0,180.0,3 weeks ago,t,4,17,47,322,2019-09-19,168,18,2010-07-06,2019-07-09,93,10,10,10,10,10,10,t,,,f,f,moderate,f,f,3,3,0,0,1.50
30959,https://www.airbnb.com/rooms/30959,20190919050215,2019-09-19,Beautiful loft in Madrid Center,"Beautiful Loft 60m2 size just in the historical center of Madrid (Lavapiés/Tirso de Molina)  with 3 balconies, wood floor, Two columns and a library separate the sitting to the bedroom. New & bright bathroom and kitchen","Alquilo Loft en pleno centro de Madrid (60m2), al lado de todos los museos, y lugares culturales y de ocio para visitar. Situado en la zona de lavapiés/Antón Martín Está en una casa antigua rehabilitada, con suelo de madera de roble, calefacción de gas natural. Dos columnas y una estantería separan el salón del dormitorio.  Tiene también un baño y una cocina, que dan al salón.","Beautiful Loft 60m2 size just in the historical center of Madrid (Lavapiés/Tirso de Molina)  with 3 balconies, wood floor, Two columns and a library separate the sitting to the bedroom. New & bright bathroom and kitchen",none,"","","","","","",,,https://a0.muscache.com/im/pictures/78173471/835e5c34_original.jpg?aki_policy=large,,132883,https://www.airbnb.com/users/show/132883,Angela,2010-05-26,"Madrid, Community of Madrid, Spain","Estoy empezando en Airbnb y deseo que mis huéspedes estén contentos. Me gusta mi ciudad Madrid. Y puedo recomendar lugares para disfrutar de su casco histórico, y de sus actividades culturales y sociales. Soy además poeta y puedo recomendaros bares y salas de actuaciones de monólogos, teatro y poesía",N/A,N/A,N/A,f,https://a0.muscache.com/im/users/132883/profile_pic/1430685585/original.jpg?aki_policy=profile_small,https://a0.muscache.com/im/users/132883/profile_pic/1430685585/original.jpg?aki_policy=profile_x_medium,Embajadores,1,1,"['email', 'phone', 'facebook', 'reviews']",t,f,"Madrid, Comunidad de Madrid, Spain",Centro,Embajadores,Centro,Madrid,Comunidad de Madrid,28012,Madrid,"Madrid, Spain",ES,Spain,40.41111,-3.70269,t,Loft,Entire home/apt,2,1.0,1,1,Real Bed,"{TV,""Cable TV"",Internet,Wifi,Kitchen,""Smoking allowed"",""Pets allowed"",Doorman,Breakfast,Elevator,""Buzzer/wireless intercom"",Heating,Washer,Essentials,Shampoo,""translation missing: en.hosting_amenity_49"",""translation missing: en.hosting_amenity_50""}",172,$54.00,$400.00,"$1,300.00",,,1,$0.00,3,730,3,3,730,730,3.0,730.0,27 months ago,t,0,0,0,0,2019-09-19,8,0,2015-05-12,2017-05-30,88,8,9,9,9,10,9,t,,,f,f,moderate,f,f,1,1,0,0,0.15
40916,https://www.airbnb.com/rooms/40916,20190919050215,2019-09-19,Holiday Apartment Madrid Center,"","We rent fully furnished holiday apartments right in the center of Madrid. Our apartments are confortable, spatious, fully equipped with basic cooking utensills, Tv, air conditioning, bed linen, dishwasher, laundry machine. We also offer services like cleaning of the apartment every 7 days, and change of towels every 2 days.  All these servises are included in the price. Our apartments accommodate up to 4 people. They are perfect for families, groups of youg people, students, or bussiness travelers.    ","We rent fully furnished holiday apartments right in the center of Madrid. Our apartments are confortable, spatious, fully equipped with basic cooking utensills, Tv, air conditioning, bed linen, dishwasher, laundry machine. We also offer services like cleaning of the apartment every 7 days, and change of towels every 2 days.  All these servises are included in the price. Our apartments accommodate up to 4 people. They are perfect for families, groups of youg people, students, or bussiness travelers.    ",none,"","","","","","",,,https://a0.muscache.com/im/pictures/336736/c3b486c8_original.jpg?aki_policy=large,,130907,https://www.airbnb.com/users/show/130907,Dana,2010-05-24,"Madrid, Madrid, Spain","Apartasol offers a network of several spacious, comfortable apartments in the vibrant heart of Madrid.  The apartments are situated in three different locations, all very central and within walking distance from each other.  The sizes range from 35m 2 studios to 75m 2 two bedroom apartments and they can accommodate from 1 person up to 6 people depending on the type and size of the apartment.  Recently refurbished, the apartments are sure to preserve the traditional Madrileño look. Apartasol is well known for its extremely friendly staff and impeccable cleaning services",within an hour,100%,N/A,t,https://a0.muscache.com/im/users/130907/profile_pic/1373028590/original.jpg?aki_policy=profile_small,https://a0.muscache.com/im/users/130907/profile_pic/1373028590/original.jpg?aki_policy=profile_x_medium,Sol,3,3,"['email', 'phone', 'reviews']",t,f,"Madrid, Community of Madrid, Spain",Centro,Universidad,Centro,Madrid,Community of Madrid,28004,Madrid,"Madrid, Spain",ES,Spain,40.42096,-3.70428,t,Apartment,Entire home/apt,3,1.0,1,3,Real Bed,"{TV,Wifi,""Air conditioning"",Kitchen,""Pets allowed"",Elevator,Heating,""Family/kid friendly"",Washer}",,$90.00,$600.00,,,,1,$0.00,3,180,3,3,180,180,3.0,180.0,3 weeks ago,t,12,36,66,337,2019-09-19,38,9,2010-11-01,2019-07-07,94,9,10,10,10,10,9,t,,,t,f,moderate,f,f,3,3,0,0,0.35
59923,https://www.airbnb.com/rooms/59923,20190919050215,2019-09-19,Habitación para féminas en el centro de Madrid,"Si eres mujer, en nuestra casa encontrarás un ambiente muy familiar y seguro. La habitación cuenta con muchos elementos y  detalles decorativos para que te sientas a gusto (televisión, calefacción, ventilador....). El desayuno es abundante. Yo te proporcionaré toda la información que puedas necesitar durante tu estancia e, incluso, estoy dispuesta a llevarte personalmente a los lugares de interés. Y es que nuestra casa está en pleno centro de la ciudad, a un paso de todos los lugares turísticos.","Te ofrezco una preciosa habitación individual (con baño, aunque no dentro del cuarto), en pleno Madrid de los Austrias, junto al Palacio Real. Se trata de la zona más turística de la capital de España, rodeada de puntos de interés (museos, parques, cines, tiendas, restaurantes) pero en una calle pequeña y tranquila, junto a un convento del siglo XVII.La habitación no es muy grande, pero cuenta con todo tipo de comodidades: cama, armario, mesa de trabajo, butaca, estanterías, cajones, TV, varios puntos de luz... Como da a un patio interior, se garantiza la tranquilidad.","Si eres mujer, en nuestra casa encontrarás un ambiente muy familiar y seguro. La habitación cuenta con muchos elementos y  detalles decorativos para que te sientas a gusto (televisión, calefacción, ventilador....). El desayuno es abundante. Yo te proporcionaré toda la información que puedas necesitar durante tu estancia e, incluso, estoy dispuesta a llevarte personalmente a los lugares de interés. Y es que nuestra casa está en pleno centro de la ciudad, a un paso de todos los lugares turísticos. Te ofrezco una preciosa habitación individual (con baño, aunque no dentro del cuarto), en pleno Madrid de los Austrias, junto al Palacio Real. Se trata de la zona más turística de la capital de España, rodeada de puntos de interés (museos, parques, cines, tiendas, restaurantes) pero en una calle pequeña y tranquila, junto a un convento del siglo XVII.La habitación no es muy grande, pero cuenta con todo tipo de comodidades: cama, armario, mesa de trabajo, butaca, estanterías, cajones, TV, varios",none,"Nuestra casa está en el centro de la ciudad, a un paso de las principales zonas de interés cultural (museos, palacios, parques o monumentos), y rodeados de restaurantes, tiendas, discotecas, teatros, y numerosos medios de transporte (trenes, taxis y distintas líneas de metro y autobús).  Nuestra calle es muy tranquila y segura (estamos junto a una comisaría de policía).","Vivimos en una zona muy tranquila, pese a que nuestra casa está en el  centro de Madrid, y, aunque somos pocos vecinos, hay muchos ancianos y niños, por eso se valora mucho el silencio, tanto de día como, especialmente, de noche. Pero eso tiene algo bueno: en nuestra casa se duerme fantásticamente bien.","Hay muchas líneas de metro y autobús, taxis por todas partes y hasta dos estaciones de tren de cercanías.  Nuestra casa está a menos de una hora en metro del aeropuerto.","La habitación es privada, no así el cuarto de baño. La huésped tendrá que compartirlo con mi hija, de ahí que se ruego un uso razonable de este espacio.  La huésped también podrá usar la cocina para desayunar. Pero se recuerda que no está permitido cocinar. Dependiendo del tipo de estancia, también podrá compartir el salón con la familia.","Obviamente, yo estoy dispuesta a ayudar a la huésped resolviendo sus dudas sobre el alojamiento, la ciudad, la mejor manera de llegar a mi casa, etc, desde el mismo momento en que contacte conmigo interesándose por mi casa. Asimismo, dependiendo de a qué hora llegue a mi casa, estoy dispuesta a quedar con ella a la salida del metro más cercano para traerla a casa. Por supuesto, durante su estancia, puede contar conmigo para lo que necesite. Es más, como actualmente trabajo como guía turística privada, no tengo ningún inconveniente en hacerle un tour por la ciudad o, simplemente, darle dirección sobre lugares de interés. Quiero que su estancia sea inolvidable, por lo que estoy a su disposición para que así sea.","-Se aceptan huéspedes de cualquier edad, eso sí, sólo del sexo femenino.  -No se aceptan huéspedes fumadores. -Se ruega respete el silencio de la casa (sobre todo por las noches) y evitar a toda costa los portazos.  -Está prohibido ducharse y usar el secador más tarde de las 11 de la noche y antes de las 6.30 de la mañana.  -Asimismo, se le pide a la huésped  que sea limpia y ordenada. -El alojamiento incluye el desayuno (pero no más tarde de las 12 del mediodía). La comida y la cena también puede ofrecérsele a la huésped, pero se pagará aparte. No se ofrece esta opción si la huésped es vegetariana o si tiene alergias alimentarias serias (como al huevo o el gluten. Si es intolerancia a la lactosa, no hay ningún problema). -La señora de la casa es profesora de español, por lo que puede impartir clases en este idioma si la huésped lo desea. Igualmente, se pueden organizar salidas turísticas a museos y otros lugares de interés. -Cuando la huésped llegue, se le entregará una llave. Si la p",,,https://a0.muscache.com/im/pictures/365063/5923ecd4_original.jpg?aki_policy=large,,288380,https://www.airbnb.com/users/show/288380,Patricia,2010-11-16,"Madrid, Community of Madrid, Spain","Me llamo Patricia, tengo 50 años y soy periodista freelance,  profesora de Lengua Española y Literatura, y de Inglés, y, actualmente también, guía turística. 
Me gusta muchísimo hablar y adoro la ciudad en la que vivo, Madrid (aunque yo nací en Barcelona). Por eso, leo mucho sobre la historia de Madrid y sus (Website hidden by Airbnb) y curiosidades. Mis aficiones son leer, pero también escuchar música, viajar, pasear, cocinar (dicen que soy buena cocinera), ir al cine y conocer a gente y distintas culturas.
Mi marido se llama Manolo, tiene 52 años y es Diseñador Gráfico, aunque ahora está llevando el negocio de su madre: una Lotería. Habla perfectamente Inglés y Francés.
Mi hija, Laura, tiene 20 años y es muy buena estudiante. Le gusta mucho la moda, el cine, la música y viajar. 
Tenemos dos perritas, Kira, de 10 años, y Dalia, de casi dos cuatro, que hemos adoptamos porque estaban abandonadas. Son amorosas. ¡¡¡¡Sólo quieren jugar, comer y que les hagan caricias!!!
Así somos nosotros, ¿y tú? Si eres mujer (desde 12 años en adelante), y no fumas, estamos deseando  conocerte. ",within a few hours,100%,N/A,f,https://a0.muscache.com/im/pictures/58c5c44d-6c98-43d5-baec-980d08c1a1cd.jpg?aki_policy=profile_small,https://a0.muscache.com/im/pictures/58c5c44d-6c98-43d5-baec-980d08c1a1cd.jpg?aki_policy=profile_x_medium,Palacio,1,1,"['email', 'phone', 'facebook', 'reviews']",t,f,"Madrid, Madrid, Spain",Palacio,Palacio,Centro,Madrid,Madrid,28013,Madrid,"Madrid, Spain",ES,Spain,40.41971,-3.71256,t,Guest suite,Private room,1,1.0,1,1,Real Bed,"{TV,Internet,Wifi,""Paid parking off premises"",Doorman,Breakfast,""Pets live on this property"",Dog(s),Elevator,Heating,""Smoke detector"",""Carbon monoxide detector"",""First aid kit"",""Fire extinguisher"",Essentials,Shampoo,Hangers,""Hair dryer"",""translation missing: en.hosting_amenity_49"",""translation missing: en.hosting_amenity_50"",""Hot water"",""Host greets you"",""Paid parking on premises""}",,$40.00,$245.00,,,,1,$0.00,1,30,1,1,30,30,1.0,30.0,today,t,28,58,88,363,2019-09-19,14,2,2011-09-26,2018-12-09,98,10,10,10,10,10,10,t,,,f,f,flexible,t,t,1,0,1,0,0.14
62423,https://www.airbnb.com/rooms/62423,20190919050215,2019-09-19,MAGIC ARTISTIC HOUSE IN THE CENTER OF MADRID,"INCREDIBLE HOME OF AN ARTIST SURROUNDED BY PAINTINGS AND ARTWORK. AMPLE AND BRIGHT APARTMENT OF 120 M2 WITH A SPACIOUS, OPEN KITCHEN. PERFECT TO COOK AT HOME AND ENJOY DINNER. FEEL HOME AT THIS WELL AND PLEASANT FLAT WITH A SPECIAL DECORATED LIVING ROOM. AVAILABLE DURING THE WHOLE GAYPRIDE  ENJOY MADRID´S TRENDIEST DISTRICT WITHIN A COZY ATMOSPHERE IN THE CENTER OF MADRID BETWEEN GRAN VIA AND CHUECA. FULL OF ART MUSEUMS, PRADO MUSEUM, rEINA SOFIA AND THYSSEN ART MUSEUM, CLOSE TO MY APARTMENT",120M2 BIG FLAT WITH 1 BEDROOMS WITH A QUEEN SIZE BED AND A SOFA BED FOR A THIRD GUEST. I LIVE IN THE APARTMENT,"INCREDIBLE HOME OF AN ARTIST SURROUNDED BY PAINTINGS AND ARTWORK. AMPLE AND BRIGHT APARTMENT OF 120 M2 WITH A SPACIOUS, OPEN KITCHEN. PERFECT TO COOK AT HOME AND ENJOY DINNER. FEEL HOME AT THIS WELL AND PLEASANT FLAT WITH A SPECIAL DECORATED LIVING ROOM. AVAILABLE DURING THE WHOLE GAYPRIDE  ENJOY MADRID´S TRENDIEST DISTRICT WITHIN A COZY ATMOSPHERE IN THE CENTER OF MADRID BETWEEN GRAN VIA AND CHUECA. FULL OF ART MUSEUMS, PRADO MUSEUM, rEINA SOFIA AND THYSSEN ART MUSEUM, CLOSE TO MY APARTMENT 120M2 BIG FLAT WITH 1 BEDROOMS WITH A QUEEN SIZE BED AND A SOFA BED FOR A THIRD GUEST. I LIVE IN THE APARTMENT INTERNET WIFI, BIG LIVING ROOM AND KITCHEN ALWAYS AVAILABLE THROUGH (Hidden by Airbnb)  DISTRICT WITH VERY GOOD VIBES IN THE MIDDLE OF MADRID, BESIDE GRAN VÍA AND ALCALÁ (METRO BANCO DE ESPAÑA (METRO LINE 2) VERY GOOD LOCATION AT CHUECA DISTRICT FULL OF RESTAURANTS, MUSEUMS, CINEMAS, DISCOS AND BARS. SUBWAY LINE 2, ""BANCO DE ESPAÑA"" STATION OR LINE 5, ""CHUECA"" STATION. THE BEST WAY TO ARRI",none,"DISTRICT WITH VERY GOOD VIBES IN THE MIDDLE OF MADRID, BESIDE GRAN VÍA AND ALCALÁ (METRO BANCO DE ESPAÑA (METRO LINE 2) VERY GOOD LOCATION AT CHUECA DISTRICT FULL OF RESTAURANTS, MUSEUMS, CINEMAS, DISCOS AND BARS.","THE BEST WAY TO ARRIVE TO MY APARTMENT IS BY CATCHING THE BUS THAT LEAVES FROM THE AIRPORT IN ADDRESS TO ""PLAZA CIBELES"" IT TAKES 25 MIN. AND COST YOU 5 €. FROM THERE, THE APARTMENT IS 5 MIN. WALKING. YOU GO TO ""GRAN VÍA AVENUE"" AND YOU TURN TO THE RIGHTS IN ""MARQUÉS DE VALDEIGLESIAS STREET"" AND THE FIRST STREET YOU WILL FIND TO YOUR LEFT AND PARALLEL TO THE GRAN VIA, IS ""REINA STREET"", THERE, IS MY HOUSE, NUMBER 39","SUBWAY LINE 2, ""BANCO DE ESPAÑA"" STATION OR LINE 5, ""CHUECA"" STATION.","INTERNET WIFI, BIG LIVING ROOM AND KITCHEN",ALWAYS AVAILABLE THROUGH (Hidden by Airbnb),RESPECT FOR THE OTHERS.,,,https://a0.muscache.com/im/pictures/849563ec-96f9-4a61-aba3-d14399548860.jpg?aki_policy=large,,303845,https://www.airbnb.com/users/show/303845,Arturo,2010-11-29,"Madrid, Madrid, Spain","I am an artist... you can check my website

w (Website hidden by Airbnb) 

 (Website hidden by Airbnb) 

",within an hour,100%,N/A,f,https://a0.muscache.com/im/pictures/user/cd45cd23-7f8c-4439-ba2a-1b3c064825e5.jpg?aki_policy=profile_small,https://a0.muscache.com/im/pictures/user/cd45cd23-7f8c-4439-ba2a-1b3c064825e5.jpg?aki_policy=profile_x_medium,Justicia,2,2,"['email', 'phone', 'facebook', 'reviews', 'manual_offline', 'jumio', 'selfie', 'government_id', 'identity_manual']",t,t,"Madrid, Madrid, Spain",Centro,Justicia,Centro,Madrid,Madrid,28004,Madrid,"Madrid, Spain",ES,Spain,40.4208,-3.69878,t,Apartment,Private room,3,1.5,1,2,Real Bed,"{Internet,Wifi,Kitchen,""Smoking allowed"",""Pets allowed"",Doorman,""Pets live on this property"",Dog(s),Cat(s),""Other pet(s)"",""Buzzer/wireless intercom"",Heating,Washer,Dryer,""First aid kit"",Essentials,Shampoo,Hangers,""Hair dryer"",Iron,""Laptop friendly workspace"",""translation missing: en.hosting_amenity_50"",""Self check-in"",""Building staff"",""Hot water"",""Extra pillows and blankets"",""Pocket wifi""}",0,$45.00,$555.00,"$1,712.00",$200.00,$22.00,2,$25.00,1,30,1,1,30,30,1.0,30.0,today,t,21,51,81,352,2019-09-19,57,40,2018-05-10,2019-07-29,90,10,9,10,10,10,9,t,,,t,f,strict_14_with_grace_period,f,f,2,0,2,0,3.43
