id,listing_url,scrape_id,last_scraped,name,summary,space,description,experiences_offered,neighborhood_overview,notes,transit,access,interaction,house_rules,thumbnail_url,medium_url,picture_url,xl_picture_url,host_id,host_url,host_name,host_since,host_location,host_about,host_response_time,host_response_rate,host_acceptance_rate,host_is_superhost,host_thumbnail_url,host_picture_url,host_neighbourhood,host_listings_count,host_total_listings_count,host_verifications,host_has_profile_pic,host_identity_verified,street,neighbourhood,neighbourhood_cleansed,neighbourhood_group_cleansed,city,state,zipcode,market,smart_location,country_code,country,latitude,longitude,is_location_exact,property_type,room_type,accommodates,bathrooms,bedrooms,beds,bed_type,amenities,square_feet,price,weekly_price,monthly_price,security_deposit,cleaning_fee,guests_included,extra_people,minimum_nights,maximum_nights,minimum_minimum_nights,maximum_minimum_nights,minimum_maximum_nights,maximum_maximum_nights,minimum_nights_avg_ntm,maximum_nights_avg_ntm,calendar_updated,has_availability,availability_30,availability_60,availability_90,availability_365,calendar_last_scraped,number_of_reviews,number_of_reviews_ltm,first_review,last_review,review_scores_rating,review_scores_accuracy,review_scores_cleanliness,review_scores_checkin,review_scores_communication,review_scores_location,review_scores_value,requires_license,license,jurisdiction_names,instant_bookable,is_business_travel_ready,cancellation_policy,require_guest_profile_picture,require_guest_phone_verification,calculated_host_listings_count,calculated_host_listings_count_entire_homes,calculated_host_listings_count_private_rooms,calculated_host_listings_count_shared_rooms,reviews_per_month
6369,https://www.airbnb.com/rooms/6369,20190919050215,2019-09-19,"Rooftop terrace room with ensuite bathroom, Airc.","Atico en la calle Principe de Vergara, con baño ensuite y acceso directo a gran terraza. Literalmente al lado del metro Colombia , directo al aeropuerto  y al recinto ferial IFEMA Feria de Madrid. Close to Real Madrid stadium.","BETTER THAN A HOTEL.Upscale neighboorhood (Metro Colombia direct to airport,super convenient entrance right next to the building ). Lots of shops. 20min by public transport to downtown (direct bus or subway). The non smoking room ,(16sqm/ 180sqfeet) with double bed , has lots of privacy with its own ENSUITE BATHROOM-inside the room- and a door with direct access to the huge sunny and full of plants terraCEe(620 sq feet / 60 sqm)).  The room has as well AIR CON / HEATING and WIFI INTERNET.  Guests have full acces to the rest of the flat, including kitchen with all appliances (coffe machine, microwave, water boiler, dishwasher : no need to clean dishes!, etc... The apartment is situated in a pleasant neighborhood. Contact , please, if you need more information about the apartment, amenities or the situation where it is in Madrid , i will be happy to reply your questions. Thank you and","BETTER THAN A HOTEL.Upscale neighboorhood (Metro Colombia direct to airport,super convenient entrance right next to the building ). Lots of shops. 20min by public transport to downtown (direct bus or subway). The non smoking room ,(16sqm/ 180sqfeet) with double bed , has lots of privacy with its own ENSUITE BATHROOM-inside the room- and a door with direct access to the huge sunny and full of plants terraCEe(620 sq feet / 60 sqm)).  The room has as well AIR CON / HEATING and WIFI INTERNET.  Guests have full acces to the rest of the flat, including kitchen with all appliances (coffe machine, microwave, water boiler, dishwasher : no need to clean dishes!, etc... The apartment is situated in a pleasant neighborhood. Contact , please, if you need more information about the apartment, amenities or the situation where it is in Madrid , i will be happy to reply your questions. Thank you and English, spanish, german, russian, some french spoken. We are available for assistance and to make your ",none,Nice and definitely  non touristic neighborhood with plenty of shops and restaurants. A market is across the Street as well as a couple of supermarkets and take away food shops. Some nice bars to hang around during the day and in the evening full of locals.,If you are a group/family 3 or 4 people we offer a second extra bedroom for reasonable price.,"Excelent public transport and easy Access to metro and airport and IFEMA exhibition center. Metro opens at 6am and is 4 or 6 stops from the airport, depending on the terminal. The metro has lift in case you have bulky lugagge. Taxi to airport is flat rate 30 euros ( or around 20 for Cabify). In the area are available electric cars on the go (check car2go, Zity, Emov or Wible).","Full use of living room, kitchen (with dishwasher)  and terrace . Washing maschine.","English, spanish, german, russian, some french spoken. We are available for assistance and to make your stay in Madrid more enjoyable. Felxible check out time. If the room is booked you can leave the lugagge at home and use the common áreas and courtesy bathroom/shower.","",,,https://a0.muscache.com/im/pictures/683224/4cc318c4_original.jpg?aki_policy=large,,13660,https://www.airbnb.com/users/show/13660,Simon,2009-04-16,"Madrid, Madrid, Spain","Gay couple, heterofriendly, enjoy having guests home. I am Marketing professional and Simon is contemporary dancer.
Fluent in several languages: spanish, english, german, russian..",within a few hours,100%,N/A,f,https://a0.muscache.com/im/users/13660/profile_pic/1259103032/original.jpg?aki_policy=profile_small,https://a0.muscache.com/im/users/13660/profile_pic/1259103032/original.jpg?aki_policy=profile_x_medium,Hispanoamérica,2,2,"['email', 'phone', 'reviews', 'jumio', 'offline_government_id', 'government_id']",t,f,"Madrid, Comunidad de Madrid, Spain",Chamartín,Hispanoamérica,Chamartín,Madrid,Comunidad de Madrid,28016,Madrid,"Madrid, Spain",ES,Spain,40.45628,-3.67763,t,Apartment,Private room,2,1.0,1,0,Real Bed,"{Wifi,""Air conditioning"",Kitchen,Elevator,Heating,""Family/kid friendly"",Washer,Essentials,Shampoo,Hangers,""Hair dryer"",Iron,""Hot water"",""Bed linens"",""Extra pillows and blankets"",""Pocket wifi""}",172,$70.00,$350.00,$950.00,$0.00,$5.00,2,$15.00,1,365,1,1,365,365,1.0,365.0,2 days ago,t,14,23,53,53,2019-09-19,65,6,2010-03-14,2019-09-04,98,10,10,9,10,9,10,t,,,f,f,flexible,f,f,1,0,1,0,0.56
21853,https://www.airbnb.com/rooms/21853,20190919050215,2019-09-19,Bright and airy room,"We have a quiet and sunny room with a good view in our 3 bedroom flat. In a welcoming atmosphere, our clean and respectful flatshare is located in a leafy neighbourhood with all facilities: shops, library, cafés and bars, a swimming pools, gyms, and fantastic parks. Well connected by metro and bus with the centre: 15 minutes. For walks, we are also a 20 min stroll away from the riverside.","I am living in a nice flat near the centre of Madrid (15 minutes by bus). We are relaxed, clean, and independent. The flat is located in a leafy neighbourhood with plenty of facilities: little shops, supermarkets, public library, swimming pools (covered and summer ones), tennis courts and free parking outside the flat. It is well connected by public transport (various bus and metro lines). The room is sunny and well presented. There are two bathrooms, one of which you would share with a guest. It has triple glazing and we provide fresh bedlinen and towels, so that packing is lighter for our guests. We like clean, relaxed and polite people of any race, country or culture. The building has had a patio with some plants and there is a concierge. We are on the third floor (and yes, there is a lift). There is air conditioning in the living room for the hot summer months, and central heating throughout the entire flat, as well as telephone, fibre optic Internet connection.   Long stays are we","We have a quiet and sunny room with a good view in our 3 bedroom flat. In a welcoming atmosphere, our clean and respectful flatshare is located in a leafy neighbourhood with all facilities: shops, library, cafés and bars, a swimming pools, gyms, and fantastic parks. Well connected by metro and bus with the centre: 15 minutes. For walks, we are also a 20 min stroll away from the riverside. I am living in a nice flat near the centre of Madrid (15 minutes by bus). We are relaxed, clean, and independent. The flat is located in a leafy neighbourhood with plenty of facilities: little shops, supermarkets, public library, swimming pools (covered and summer ones), tennis courts and free parking outside the flat. It is well connected by public transport (various bus and metro lines). The room is sunny and well presented. There are two bathrooms, one of which you would share with a guest. It has triple glazing and we provide fresh bedlinen and towels, so that packing is lighter for our guests. We",none,"We live in a leafy neighbourhood with plenty of green areas and recreational opportunities such as the library, gyms, swimming pools (covered and summer ones), and the tennis courts. Parking is free outside and it is relatively easy to park near the flat.","We are a 15 min bus ride away from the Casa de Campo forest, as well as the zoo and the theme park there. We are also a 20 min stroll to the riverside, and just 5 minutes away from a fantastic park: great for runs and walks. On the other hand, it is not a comfortable accommodation for pets.","The flat is near the centre of Madrid (15 minutes by bus). We are well connect by public transport: several buses (31 and 138 and more), metro line L6 and Cercanías trains. If you are bringing your car, parking is free outside. There is a bycicle lane too.","There is fibre optic internet connection for you to use. We share the living room and the bathroom is normally shared with one other person only, as there are actually two bathrooms in the flat. Please make sure you you take care to keep it nice and clean, just as we do. Guests can use the kitchen when staying for more than 3 nights.","If I am at home and see each other around here, it will be a pleasure to have interesting talks. If you need to ask or let me know about anything, feel free to knock on my bedroom door.",Many thanks for not smoking at home.,,,https://a0.muscache.com/im/pictures/68483181/87bcac58_original.jpg?aki_policy=large,,83531,https://www.airbnb.com/users/show/83531,Abdel,2010-02-21,"Madrid, Madrid, Spain","EN-ES-FR
EN
Hi everybody: I'm Abdel. I'm spanish originaly from Casablanca (Morocco). I've been living for many years in Andlusian area and now in Madrid that I like very much, since 11 years. My job is related with languages and communication. I'm a quiet person. I don't smoke, and I do some sport. I like nature, painting and photography.
Please, do ask me any thing you consider useful for you. 
Kind regards.
 -----
ES
Hola chicos y chicas: soy Abdel. Soy español original de Casablanca, Marruecos. He vivido muchos años en Andalucía y ahora llevo casi 11 años en Madrid, que me encanta. Mi trabajo está relacionado con las lenguas y la comunicación. Soy una persona tranquila y algo reflexiva. No fumo, hago algo de deportes, y me gusta además de la naturaleza, la puntura y la fotografía.
En caso de necesidad, no duden en plantearme cualquier pregunta que consideran oportuna. 
Un cordial saludo.

FR
Bonjour, tout le monde,
Je suis Abdel, espagnol d'origine marocaine (de Casablanca). J'ai vécu pendant plusieurs années en Andalousie, mais maintenant je suis installé à Madrid depuis 11 ans. Je suis une personne cool et un peu pensatif. Je ne fume pas et je pratique un peu de sport. D'autre part, je suis un amoureux de la nature, la peinture et la photographie. S'il vous plait, n'hesitez pas de me poser des questions, si vous en avez besoin ...
Cordialement,",N/A,N/A,N/A,f,https://a0.muscache.com/im/users/83531/profile_pic/1338760896/original.jpg?aki_policy=profile_small,https://a0.muscache.com/im/users/83531/profile_pic/1338760896/original.jpg?aki_policy=profile_x_medium,Aluche,2,2,"['email', 'phone', 'reviews', 'manual_offline', 'jumio', 'offline_government_id', 'government_id']",t,t,"Madrid, Madrid, Spain",Aluche,Cármenes,Latina,Madrid,Madrid,28047,Madrid,"Madrid, Spain",ES,Spain,40.40341,-3.74084,f,Apartment,Private room,1,1.0,1,1,Real Bed,"{TV,Internet,Wifi,""Air conditioning"",Kitchen,""Free parking on premises"",Doorman,Elevator,Heating,Washer,""First aid kit"",""Fire extinguisher"",Essentials,Shampoo,""Lock on bedroom door"",Hangers,""Hair dryer"",Iron,""Laptop friendly workspace"",""translation missing: en.hosting_amenity_49"",""translation missing: en.hosting_amenity_50"",""Hot water"",""Bed linens"",""Extra pillows and blankets"",""Pocket wifi"",Microwave,""Coffee maker"",Refrigerator,""Dishes and silverware"",""Cooking basics"",Oven}",97,$17.00,$98.00,$370.00,,,1,$8.00,4,40,4,4,40,40,4.0,40.0,8 months ago,t,0,0,0,48,2019-09-19,33,0,2014-10-10,2018-07-15,92,9,9,10,10,8,9,t,,,f,f,strict_14_with_grace_period,f,f,2,0,2,0,0.55
24805,https://www.airbnb.com/rooms/24805,20190919050215,2019-09-19,Gran Via Studio Madrid,"Studio located 50 meters from Gran Via, next to the Plaza de Callao. In the best shopping and cinemas and theaters. Comfortable apartment for 3 people. 1 bed and  the sofa bed in the lounge. Fully furnished.","LOCATION.  Brand new flats near the Atlantic Hotel, 50 meters from Gran Vía and Zara, H & M, Desigual, theaters and all the premieres and Music of Madrid.  This home is located in a prime location in the heart of entertainment and shopping. A step away from everything you want to see in Madrid. The Puerta del Sol, Plaza Mayor, the Mercado de San Miguel, Theatre Royal and Royal Palace  The area is known as Plaza de Callao and near Chueca, Plaza Mayor is the most emblematic monument of the city, where cultural and leisure activities is concentrated: international restaurants, terraces and shops trends. No need or public transportation, you're just steps from the famous La Latina, the Royal Palace, Opera House, Sun, and of course Gran Via Best gourmet tapas at Mercado de San Miguel, amazing renovated modernist building, right on the corner.  1 minute from the Puerta del Sol, the street price and Calle Fuencarral, Chueca and all the more modern part of Madrid  A 1 minute (50 m) of Gran Via","Studio located 50 meters from Gran Via, next to the Plaza de Callao. In the best shopping and cinemas and theaters. Comfortable apartment for 3 people. 1 bed and  the sofa bed in the lounge. Fully furnished. LOCATION.  Brand new flats near the Atlantic Hotel, 50 meters from Gran Vía and Zara, H & M, Desigual, theaters and all the premieres and Music of Madrid.  This home is located in a prime location in the heart of entertainment and shopping. A step away from everything you want to see in Madrid. The Puerta del Sol, Plaza Mayor, the Mercado de San Miguel, Theatre Royal and Royal Palace  The area is known as Plaza de Callao and near Chueca, Plaza Mayor is the most emblematic monument of the city, where cultural and leisure activities is concentrated: international restaurants, terraces and shops trends. No need or public transportation, you're just steps from the famous La Latina, the Royal Palace, Opera House, Sun, and of course Gran Via Best gourmet tapas at Mercado de San Miguel, a",none,"The area is next to the Gran Via, so people living in the area is mostly tourists. Being so well located, it is very interesting for short stays.",Just enjoy your trip.,"To go from the airport you have several different options: - By Metro (You take the ""line 8"" metro to Nuevos Ministerios, there you take the ""line 10"" Puerta del Sur direction and get off at Alonso Martinez and change “line 5” from Callao Station, takes about 35 minutes and costs 4,5€). - By taxi (approximately 20 minutes and costs about 30 €). - By bus (there is an express bus, takes about 35 minutes to Cibeles, then you have to take the subway in Banco de España ""line 2"" Cuatro Caminos direction, until Sol, take the ""Line 1"" in direction Pinar de Chamartin and down in Callao, in total takes about 50 minutes). I recommend the subway, it is cheaper and you have no problem with the suitcase (Madrid is very safe, but beware of pickpockets on the subway and in tourist areas). I think it does go by metro take you 1 hour between taking the suitcase, through customs and the metro. Anyway if you see that the flight is delayed let me know before leaving to better estimate arrival time. The apa",Apartment with elevator has a storage room for guests to deposit their bags. Very well connected and located 50 meters from all shops.,I put at the disposal of my guests to facilitate information Madrid.,"During your stay it is your home. Feel it as if it were. I will make you feel special.  Please do not smoke. Pets not allowed the rules for use of the apartment is all that we apply in our own home.  Respect to neighbors, and cleanliness of the apartment and common areas.  From 22 hrs. A supplement of 20 € will be charged for late arrive to be paid at the time of arrival.",,,https://a0.muscache.com/im/pictures/5843578f-6a14-403c-b327-5c62a0d1be7d.jpg?aki_policy=large,,101471,https://www.airbnb.com/users/show/101471,Iraido,2010-03-31,"Madrid, Madrid, Spain","I love treating my clients, how I would like them to treat me.

I like new technologies, football (not fan man), movies and most important my family. I want you to feel special in my apartment, to call me if you have any problem. I want your stay in Madrid to be special. I wait for you.



**Me encanta tratar a mis clientes, como me gustaria que me trataran a mi.

 Me gustan las nuevas tecnologías, el fútbol (sin pasarme), el cine y lo mas importante en mi vida es mi familia. Quiero que te sientas especial en mi apartamento, que me llames si tienes cualquier problema, tanto en el piso como de cualquier tema. Quiero que tu estancia en Madrid sea especial. Te espero.",within a day,100%,N/A,f,https://a0.muscache.com/im/pictures/user/233f48ef-47ac-463d-afdc-eede22cf636b.jpg?aki_policy=profile_small,https://a0.muscache.com/im/pictures/user/233f48ef-47ac-463d-afdc-eede22cf636b.jpg?aki_policy=profile_x_medium,Malasaña,1,1,"['email', 'phone', 'facebook', 'reviews', 'jumio', 'government_id', 'work_email']",t,t,"Madrid, Madrid, Spain",Malasaña,Universidad,Centro,Madrid,Madrid,28004,Madrid,"Madrid, Spain",ES,Spain,40.42202,-3.70395,t,Apartment,Entire home/apt,3,1.0,0,1,Real Bed,"{TV,Internet,Wifi,""Air conditioning"",Kitchen,Elevator,""Buzzer/wireless intercom"",Heating,""Family/kid friendly"",Washer,""Fire extinguisher"",Essentials,Shampoo,""24-hour check-in"",Hangers,""Hair dryer"",Iron,""Laptop friendly workspace"",""Pack ’n Play/travel crib"",""Hot water"",Microwave,""Coffee maker"",Refrigerator,""Dishes and silverware"",""Cooking basics"",Oven,Stove,""Luggage dropoff allowed"",""Long term stays allowed"",""Cleaning before checkout"",""Host greets you"",""Paid parking on premises""}",0,$80.00,$450.00,"$1,200.00",$200.00,$30.00,2,$0.00,5,730,5,5,730,730,5.0,730.0,1 week ago,t,19,49,79,354,2019-09-19,2,0,2014-11-29,2017-07-03,100,8,8,10,10,10,10,t,,,f,f,moderate,f,f,1,1,0,0,0.03
24836,https://www.airbnb.com/rooms/24836,20190919050215,2019-09-19,"Select the Madrid more ""cool"".","Apartamento céntrico junto a Gran Vía (VT-296) con 2 dormitorios. Exterior y en la segunda planta. Situación ideal para turismo por la ciudad, visitas a museos y palacios o zonas de compras. Todo cerca, a un paso.  NOTA: Obras de restauración de fachada previstas hasta el 15 de Septiembre de 2018.","Select the Madrid more ""cool"" : 70 m, 2 bedrooms, 1 bathroom, living room with stereo and TV kitchenette equipped with microwave and Hob. Traditional building restored in the Centre, 10 minutes walk from the Puerta del Sol, next to Gran Vía and many restaurants, theatres, museums and all the cultural offer of the capital. Public transport: Metro Bank of Spain/Chueca/Gran Vía, nearby train, several bus lines,... El Madrid mas ""cool"" : Piso con unos 70 m, 2 dormitorios, 1 baño completo, salón comedor con equipo de música y TV. Cocina americana equipada con vitroceramica y microondas.  El apartamento se encuentra dentro de un edifio tradicional rehabilitado, en pleno centro, a 10 minutos andando de la Puerta del Sol, junto a Gran Vía y y al recién reformado Mercado de San Antón, donde podrás degustar todo tipo de tapas o tomar una copa en su terraza en la última planta. Es un barrio animado con múltiples restaurantes y bares de copas. A pocos pasos puedes encontrar las tiendas mas vanguar","Select the Madrid more ""cool"" : 70 m, 2 bedrooms, 1 bathroom, living room with stereo and TV kitchenette equipped with microwave and Hob. Traditional building restored in the Centre, 10 minutes walk from the Puerta del Sol, next to Gran Vía and many restaurants, theatres, museums and all the cultural offer of the capital. Public transport: Metro Bank of Spain/Chueca/Gran Vía, nearby train, several bus lines,... El Madrid mas ""cool"" : Piso con unos 70 m, 2 dormitorios, 1 baño completo, salón comedor con equipo de música y TV. Cocina americana equipada con vitroceramica y microondas.  El apartamento se encuentra dentro de un edifio tradicional rehabilitado, en pleno centro, a 10 minutos andando de la Puerta del Sol, junto a Gran Vía y y al recién reformado Mercado de San Antón, donde podrás degustar todo tipo de tapas o tomar una copa en su terraza en la última planta. Es un barrio animado con múltiples restaurantes y bares de copas. A pocos pasos puedes encontrar las tiendas mas vanguar",none,"Cosmopolita, lleno de locales de moda, restaurantes y tiendas vanguardistas. Un barrio divertido, especialmente en fines de semana.","Al estar en el distrito Centro (Barrio de Justicia), es equidistante a las distintas áreas de la ciudad. Es de especial mención la cercanía al 'Parque del Buen Retiro', principal parque de la ciudad, mandado construir por Felipe IV para su disfrute en el siglo XVII.","La situación del apartamento hace accesibles a pie lamayor parte de puntos de interés, sin embargo rodeando al apartamento se encuentran tres estaciones distintas de Metro (Gran Vía -línea 1-, Banco de España -línea 2- y Chueca -línea 5-. También cercan están las estaciones 'Recoletos' y 'Sol' de tren Cercanías Renfe, así como varías líneas de autobús incluyendo Aeropuerto Exprés 24h.",La disponibilidad de acceso al apartamento es total para el huésped.,"El precio marcado es por el alojamiento completo. Recibimos personalmente a los huéspedes para proporcionarles la información que puedan necesitar. A pesar del horario previsto para 'check-in' y check-out, intentamos la mayor flexibilidad para comodidad del viajero.",Esperamos que los huéspedes traten la casa como si fuera suya. La disfruten y la respeten.,,,https://a0.muscache.com/im/pictures/573273/8f594dc3_original.jpg?aki_policy=large,,101653,https://www.airbnb.com/users/show/101653,Tenty,2010-03-31,"Las Rozas, Madrid, Spain","Mi mayor pasión es viajar y conocer culturas diferentes. . .   Pertenezco a la plantilla de BBVA. Mi marido, Goyo, es Consultor de Comunicación. Nos gusta recibir a nuestros huespedes y darles toda la información que requiran facilitandoles planos y guías.  Estariamos encantados de recibiros en nuestra propiedad.
Idiomas : inglés y español

",within a few hours,100%,N/A,t,https://a0.muscache.com/im/users/101653/profile_pic/1314657116/original.jpg?aki_policy=profile_small,https://a0.muscache.com/im/users/101653/profile_pic/1314657116/original.jpg?aki_policy=profile_x_medium,Justicia,1,1,"['email', 'phone', 'facebook', 'reviews']",t,f,"Madrid, Comunidad de Madrid, Spain",Justicia,Justicia,Centro,Madrid,Comunidad de Madrid,28004,Madrid,"Madrid, Spain",ES,Spain,40.41995,-3.69764,f,Apartment,Entire home/apt,4,1.5,2,3,Real Bed,"{TV,""Cable TV"",Internet,Wifi,""Air conditioning"",Kitchen,Elevator,Heating,""Family/kid friendly"",Washer,Essentials,Shampoo,Hangers,""Hair dryer"",Iron,""Hot water"",""Host greets you"",""Paid parking on premises""}",,$115.00,$600.00,,$200.00,$0.00,4,$0.00,3,1125,3,3,1125,1125,3.0,1125.0,6 weeks ago,t,3,18,48,301,2019-09-19,64,18,2011-06-02,2019-07-07,98,10,10,10,10,10,10,t,VT-296,,f,f,moderate,f,f,1,1,0,0,0.63
