82481,https://www.airbnb.com/rooms/82481,20190919050215,2019-09-19,"Retiro Park, Stay at cosy studio ","Studio inside house, but independent from it. Located in a high-end area of Madrid known as Barrio de Salamanca in an emblematic building. The location is unbeatable: a stone's throw from Retiro Park and very close to the most prestigious boutiques.","Studio flat in Barrio Salamanca can be found at number 43 of Villanueva Street, close to Velazquez and Jorge Juan Street, and  Puerta de Alcala.The location is unbeatable: a stone's throw from Retiro Park and very close to the most prestigious boutiques in Madrid , it is five minutes walking distance from Cibeles, you can walk nearly anywhere you'd want to go, a short walk of the Prado, the Reina Sofia, Thyssen Museum, etc. and a good metro stop is very close.The train station is only five stop by bus. There are a few streets that being in the centre of town enjoy the tranquillity and silence that we can fin here. Bathroom, kitchen: microwave, toaster, fridge. Heating, Wifi, plasma screen. Bathroom: shampoo, body gel. Prizes vary according to number of nights booked.   Estudio en Barrio de Salamanca se encuentra en el número 43 de la calle de Villanueva, cerca de Velázquez y la calle Jorge Juan, y la Puerta de Alcalá. Una de las ubicaciones más privilegiadas de Madrid, se puede cruzar ","Studio inside house, but independent from it. Located in a high-end area of Madrid known as Barrio de Salamanca in an emblematic building. The location is unbeatable: a stone's throw from Retiro Park and very close to the most prestigious boutiques. Studio flat in Barrio Salamanca can be found at number 43 of Villanueva Street, close to Velazquez and Jorge Juan Street, and  Puerta de Alcala.The location is unbeatable: a stone's throw from Retiro Park and very close to the most prestigious boutiques in Madrid , it is five minutes walking distance from Cibeles, you can walk nearly anywhere you'd want to go, a short walk of the Prado, the Reina Sofia, Thyssen Museum, etc. and a good metro stop is very close.The train station is only five stop by bus. There are a few streets that being in the centre of town enjoy the tranquillity and silence that we can fin here. Bathroom, kitchen: microwave, toaster, fridge. Heating, Wifi, plasma screen. Bathroom: shampoo, body gel. Prizes vary according ",none,"","El estudio esta dentro de la casa pero totalmente independiente de la misma. Desde la puerta principal,  se accede a un hall donde esta el apartamento separado del resto de la casa.","","","","no smoking please  There are not many rules to follow except those made by common sense.  I will provide written house instructions at the apartment . I have had excellent guests who kept the place immaculate, so for that I am very glad. I will happy to provide you with any information you require about the places you have “tapas” or museum, etc. I hope you feel as though you are in your own house.  Have a great visit to Madrid and Spain!",,,https://a0.muscache.com/im/pictures/580935/ddc66142_original.jpg?aki_policy=large,,448981,https://www.airbnb.com/users/show/448981,Mercedes,2011-03-18,"Madrid, Madrid, Spain","Greetings from Madrid¡¡¡¡¡
I was born and raised in Madrid, I love traveling and  I love Madrid, so I can offer you a comfortable accommodation as I would like to find when I am travelling.
I' give you a personal attention about you want to know around Madrid.
I like to establish a human relationship with my guests, I´ll be delighted to have you around. 
I look forward to making your stay gratifying and memorable.  Best wishes.

",N/A,N/A,N/A,f,https://a0.muscache.com/im/users/448981/profile_pic/1390045423/original.jpg?aki_policy=profile_small,https://a0.muscache.com/im/users/448981/profile_pic/1390045423/original.jpg?aki_policy=profile_x_medium,Recoletos,1,1,"['email', 'phone', 'reviews', 'jumio', 'offline_government_id', 'government_id']",t,t,"Madrid, Madrid, Spain",Recoletos,Recoletos,Salamanca,Madrid,Madrid,28009,Madrid,"Madrid, Spain",ES,Spain,40.42315,-3.68279,t,Apartment,Entire home/apt,2,1.0,1,1,Real Bed,"{TV,Internet,Wifi,Kitchen,Elevator,Heating,Essentials,Shampoo,""24-hour check-in"",Hangers,""Hair dryer"",Iron}",215,$60.00,$400.00,"$1,600.00",$100.00,$25.00,1,$0.00,3,365,3,3,365,365,3.0,365.0,a week ago,t,0,0,0,0,2019-09-19,108,0,2011-05-08,2017-11-29,96,9,10,10,10,10,9,t,,,f,f,flexible,f,f,1,1,0,0,1.06
84719,https://www.airbnb.com/rooms/84719,20190919050215,2019-09-19,Cool Apart. (10min Center + WIFI),"Cool and confortable 1 bedroom apartment for 2-3  in central Madrid neighborhood. Quiet. 3rd floor with elevator. Very close Tapa's bar area, museums and Rastro Open Market.","Cool 1 bedroom apartment for 2-3 guests  in CENTRAL Madrid neighborhood. Very close PUERTA DEL SOL, Tapas bar area, museums and Rastro - Tradicional open Market. Well located apartment (30m2) with fast WIFI. Very quiet and friendly. Kitchen, Bathroom (70cm shower), Living room (sofa bed 1,60x1,90m) and one bedroom (double bed 1,35x1,80m). 3rd floor with elevator.  It has ceramic hob, electric water heater 50L, Air conditioning, heater, washing machine, fridge, microwave, Iron, Hairdryer and kettle. **** For check in, it is necessary to arrange the time previously within a range of 13.00 to 23.00. It is necessary to take into account that from 21.00 there is an extra charge of € 20.","Cool and confortable 1 bedroom apartment for 2-3  in central Madrid neighborhood. Quiet. 3rd floor with elevator. Very close Tapa's bar area, museums and Rastro Open Market. Cool 1 bedroom apartment for 2-3 guests  in CENTRAL Madrid neighborhood. Very close PUERTA DEL SOL, Tapas bar area, museums and Rastro - Tradicional open Market. Well located apartment (30m2) with fast WIFI. Very quiet and friendly. Kitchen, Bathroom (70cm shower), Living room (sofa bed 1,60x1,90m) and one bedroom (double bed 1,35x1,80m). 3rd floor with elevator.  It has ceramic hob, electric water heater 50L, Air conditioning, heater, washing machine, fridge, microwave, Iron, Hairdryer and kettle. **** For check in, it is necessary to arrange the time previously within a range of 13.00 to 23.00. It is necessary to take into account that from 21.00 there is an extra charge of € 20. Madrid has much to offer you, places of great architectural and artistic interest, many palaces that once belonged or still belong to g",none,"Madrid has much to offer you, places of great architectural and artistic interest, many palaces that once belonged or still belong to great families and kings, monasteries, and churches. museums like the Museo del Prado. The best way to stay during your visit to Madrid. It is located very close to the Central Train Station (3 metro stops) to visit Toledo and Segovia and conecting with Sevilla, Málaga and Barcelona. 5-15 min. walking to Puerta del Sol, Plaza Mayor, Museums Triangle (Museo del Prado, Thyssen-Bornemisza and the Reina Sofia Art Center) and very close of tapas's Bars and local food restaurants.","","The apartment is located at few minutes from 3 Metro stops conecting to the most interesting areas. Distance from the apartment (on foot)  Prado Museum, Botanical Garden, Paseo del Prado, Museo Thyssen 15 min  Puerta del Sol, Plaza Mayor, Austrias District 5-10 min  Plaza Oriente, Palacio Real 15 min  Parque del Retiro 15 min  Rastro (sunday open Market): 2 min  Madrid is well connected with full of ancient history cities around. This will allow you, from your base in Madrid, trips to different cities like Toledo, Segovia, Ávila, Aranjuez, Alcalá de Henares, Chinchón, San Lorenzo del Escorial and the Sierra de Guadarrama.",El apartamento se encuentra en una corrala en un edificio centenario. Se puede permanecer en ella pero al pertenecer a la comunidad   es conveniente respetar el nivel de ruido y su limpieza.,Para cualquier duda o información puede ponerse en contacto preferiblemente al correo electrónico (Email hidden by Airbnb) o al teléfono/ (Hidden by Airbnb) + (Phone number hidden by Airbnb),"- The apartment  is located in a quiet building. Be careful with your noise level, please. - Turn off the heater/ac when you are out of the apartment. Don't worry, the apartment is small and the ac/heater is powerful. You are able to heat/cool the apartment in few minutes. - Smoking  is not allowed. - Parties is not allowed. - Be especially careful opening and closing the glass bathroom door, please. - If you need to hang out washing to dry, the two clotheslines nearest the flat are the ones to use - The plastic bottle outside  the flat which is used to collect the water expelled by the air-conditiong  fills up quite quickly. It is a good idea to check to see if it needs emptying - I love cats. I have two cats living in my own home but in this apartment pets is not allowed. It might come an allergic guest.",,,https://a0.muscache.com/im/pictures/5058f660-0758-4556-9b75-3a7ae6d9aa93.jpg?aki_policy=large,,259229,https://www.airbnb.com/users/show/259229,Felipe,2010-10-11,"Madrid, Madrid, Spain","Hola. Soy Felipe. Una de mis aficiones favoritas es viajar y explorar lugares y ciudades del mundo todo lo que pueda en mi tiempo libre. Me gusta alojarme en apartamentos en zonas menos turísticas pero interesantes. Así realmente creo que encontramos la esencia de ca da lugar.

Hello. I'm felipe. In muy free time I like travelling around the world and explore every place and city I prefer stay at apartments in no turist neiborghood to feel the real atmosfere. 
I love a good dinner with my couple and enjoy a drinks with my friends.  I am a responsible, clean, careful and organized person.
",within a few hours,100%,N/A,f,https://a0.muscache.com/im/users/259229/profile_pic/1350781606/original.jpg?aki_policy=profile_small,https://a0.muscache.com/im/users/259229/profile_pic/1350781606/original.jpg?aki_policy=profile_x_medium,Sol,1,1,"['email', 'phone', 'facebook', 'reviews']",t,f,"Madrid, Comunidad de Madrid, Spain",Centro,Embajadores,Centro,Madrid,Comunidad de Madrid,28012,Madrid,"Madrid, Spain",ES,Spain,40.40865,-3.70534,f,Apartment,Entire home/apt,2,1.0,1,1,Real Bed,"{TV,Wifi,""Air conditioning"",Kitchen,Elevator,Heating,""Family/kid friendly"",Washer,Essentials,Shampoo,Hangers,Iron,""Private living room"",""Hot water"",""Bed linens"",""Extra pillows and blankets"",""Pocket wifi"",Microwave,""Coffee maker"",Refrigerator,Dishwasher,""Dishes and silverware"",""Cooking basics"",Stove,""Single level home"",""Long term stays allowed"",""Host greets you"",""Paid parking on premises""}",,$60.00,$285.00,"$1,000.00",$0.00,$40.00,2,$10.00,3,1125,3,3,1125,1125,3.0,1125.0,5 days ago,t,0,0,0,0,2019-09-19,178,6,2011-05-07,2019-06-16,93,10,10,10,10,9,9,t,VT2922,,f,f,moderate,f,t,1,1,0,0,1.75
86042,https://www.airbnb.com/rooms/86042,20190919050215,2019-09-19,Cozy attic flat with intimate rooftop terrace,"The apartment is a quiet, secluded idyll in the heart of Madrid. It offers a breathtaking view of the city and the surrounding landscape from an intimate rooftop terrace. You will be at walking distance from any Madrid's site of interest","The apartment is a quiet, secluded idyll in the heart of Madrid. It offers a breathtaking view of the city and the surrounding landscape from an intimate rooftop terrace.  The apartment combines the rustic feel of ancient stone floors and exposed hardwood beams with contemporary minimalist furnishings. The main living space is a spacious, high-ceilinged living / dining area. The apartment’s renovation in 2014 preserved the typical elements of its construction, dated late-18th century, including a natural stone floor and exposed wood beams. It is bright and quiet, and the thick ancient walls keep it cool in the summer and warm in the winter. The living area is also equipped with 3 electrical heaters. The apartment was recently redecorated, mainly with furnishings from IKEA.  To understand the unusual distribution of space and particularly sleeping areas within the apartment, please look carefully at the photos as well as the detailed description below. The apartment is on the fourth flo","The apartment is a quiet, secluded idyll in the heart of Madrid. It offers a breathtaking view of the city and the surrounding landscape from an intimate rooftop terrace. You will be at walking distance from any Madrid's site of interest The apartment is a quiet, secluded idyll in the heart of Madrid. It offers a breathtaking view of the city and the surrounding landscape from an intimate rooftop terrace.  The apartment combines the rustic feel of ancient stone floors and exposed hardwood beams with contemporary minimalist furnishings. The main living space is a spacious, high-ceilinged living / dining area. The apartment’s renovation in (Phone number hidden by Airbnb) preserved the typical elements of its construction, dated late-18th century, including a natural stone floor and exposed wood beams. It is bright and quiet, and the thick ancient walls keep it cool in the summer and warm in the winter. The living area is also equipped with 3 electrical heaters. The apartment was recently",none,"","KEY HANDOVER At check in you get 2 sets of keys. At check out, you return both.   If a set is missing, a 20€ claim is processed on your deposit.  CHECK IN - CHECKOUT TIMES STANDARD CHECK IN: 3-9PM EARLY or LATE CHECK IN:  available upon request and payment of a 25€ fee. STANDARD CHECKOUT: by 11AM LATE CHECKOUT (11AM-7PM): available upon request and payment of a 25€ fee. LUGGAGE STORAGE OPTION: available upon request and payment of a 10€ fee. The above fees are independent of the number of guests. Payment is processed by accepting an AIRBNB request for extra services. CHECKOUT I use to meet my guests at checkout.  If I cannot, please make sure you have: > washed dirty dishes  > taken out garbage  > switched off electrical appliances  > shut windows and doors  > dropped keys on the living room table  before leaving the apartment.   SECURITY DEPOSIT The security deposit is released on your credit card by AIRBNB 24 hours after checkout, upon apartment inspection. Any damage that you may ha","HOW TO GET THERE (from Airport) METRO to ANTÓN MARTIN (from T1-T4, 4.5€ ticket - 75 minutes ride)  TRAIN to ATOCHA RAILWAYS STATION (from T4, 2.60€ ticket - 75 minutes ride)  TAXI (30€ fixed price, 30 minutes ride) UBER (about 20€) WHERE TO PARK THE CAR (if you have one) LOW COST PARKING  - Calle Esperanza (Phone number hidden by Airbnb)  - Calle Primavera (Phone number hidden by Airbnb)","",I like to meet my guests whenever possible.,"HOUSE RULES NUMBER OF GUESTS By renting my apartment, you agree that the apartment will not be accessed by people not included in your booking request. In case of any variation in the list of guests before arrival, you are responsible of informing me, and your reservation needs to be altered. NO PARTY RULE Any kind of party in the apartment is strictly forbidden. QUIET Loud conversations at any time of day on the terrace and/or in the apartment should be avoided. Conversations on the terrace during sleeping hours (23:00pm-08:00 am) should also be avoided. While returning to the apartment during sleeping hours please avoid conversations on the building stairs.   CLEANING Although cleaning is included in the rental price, you are kindly asked to leave the apartment in a reasonable cleaning state (e.g. no trash left inside nor unwashed dishes). NO SMOKING INSIDE Smoking is not allowed in the apartment. Smoking is allowed on the terrace. ACCIDENTAL DAMAGES You should report by the end of y",,,https://a0.muscache.com/im/pictures/12207675/648fcbe4_original.jpg?aki_policy=large,,364585,https://www.airbnb.com/users/show/364585,Vin,2011-01-27,"Madrid, Community of Madrid, Spain","About me: Music, Arts, Architecture, Glasses, Food and Wine Lover ...(not necessarily in this order)
Languages: English, Español, Italiano, Français, Deutsch. ",within an hour,100%,N/A,f,https://a0.muscache.com/im/users/364585/profile_pic/1414535061/original.jpg?aki_policy=profile_small,https://a0.muscache.com/im/users/364585/profile_pic/1414535061/original.jpg?aki_policy=profile_x_medium,Embajadores,4,4,"['email', 'phone', 'facebook', 'reviews', 'jumio', 'offline_government_id', 'selfie', 'government_id', 'identity_manual']",t,t,"Madrid, Madrid, Spain",Embajadores,Embajadores,Centro,Madrid,Madrid,28012,Madrid,"Madrid, Spain",ES,Spain,40.40894,-3.69766,t,Apartment,Entire home/apt,7,1.0,3,3,Real Bed,"{TV,Wifi,""Air conditioning"",Kitchen,""Pets allowed"",""Buzzer/wireless intercom"",Heating,""Family/kid friendly"",Washer,""Smoke detector"",""Carbon monoxide detector"",""First aid kit"",""Fire extinguisher"",Essentials,Shampoo,""24-hour check-in"",Hangers,""Hair dryer"",Iron,""Laptop friendly workspace"",""Hot water"",""Bed linens"",""Extra pillows and blankets"",Microwave,""Coffee maker"",Refrigerator,Dishwasher,""Dishes and silverware"",""Cooking basics"",Oven,Stove,""Patio or balcony"",""Luggage dropoff allowed"",""Long term stays allowed"",""Host greets you"",""Paid parking on premises""}",807,$100.00,,,$300.00,$50.00,2,$50.00,2,365,1,2,1,365,2.0,364.2,yesterday,t,15,45,75,165,2019-09-19,140,29,2011-06-20,2019-07-13,97,10,10,10,10,10,10,t,VT-3974,,f,f,flexible,f,f,5,5,0,0,1.39
89954,https://www.airbnb.com/rooms/89954,20190919050215,2019-09-19,Amazing apt in the historic center,"Beautiful, new, central and cosy apartment perfect for a family or friends trip with everything you need to feel as at your own home. We try to offer the best accommodation for our guests","Newly refurbished apartment. Beautiful, charming and comfortable. Duplex apartment: First floor with spacious living room, kitchen and bathroom. Second floor with two double bedrooms including wardrobes. Lumber room. High quality construction materials. La Latina-Austrias area. Most ancient and beautiful Downtown neighbourhood in the city but feeling like living in a small town. Street with restricted traffic. 10 minutes walking distance to Plaza Mayor and 5 minutes to Palacio Real. Next to everything (few minutes walking distance): Palacio Real, Museo del Prado, Thyssen and Reina Sofía, traditional markets, shopping, located in one of the best “tapas” areas in Madrid. High speed Internet access WI-FI, printer, i pod player, dvd and cd player, LCD TV, juicer, toaster, hairdryer, kettle, coffee maker, iron, washing maschine, dishwasher, microwave, oven, smooth top stove with four burners,dining table, etc. Also others amenities like heating and air conditioning A perfect appointed apart","Beautiful, new, central and cosy apartment perfect for a family or friends trip with everything you need to feel as at your own home. We try to offer the best accommodation for our guests Newly refurbished apartment. Beautiful, charming and comfortable. Duplex apartment: First floor with spacious living room, kitchen and bathroom. Second floor with two double bedrooms including wardrobes. Lumber room. High quality construction materials. La Latina-Austrias area. Most ancient and beautiful Downtown neighbourhood in the city but feeling like living in a small town. Street with restricted traffic. 10 minutes walking distance to Plaza Mayor and 5 minutes to Palacio Real. Next to everything (few minutes walking distance): Palacio Real, Museo del Prado, Thyssen and Reina Sofía, traditional markets, shopping, located in one of the best “tapas” areas in Madrid. High speed Internet access WI-FI, printer, i pod player, dvd and cd player, LCD TV, juicer, toaster, hairdryer, kettle, coffee maker, ",none,"If we were not from Madrid we would like someone recommends to us these sites, but it's all about taste ... TAPAS La Perejila (Calle Cava Baja, 25) Tapas from Southern Spain with traditional ""copla"" music and good ambient La taberna del Almendro 13 (Calle Almendro 13) Authentic from Madrid, even if you find some tourists there Arbonaida (Calle Santiago, 11) Tapas from Andalucía by a great chef, fresh smoothies and good ambient.  Taberna de La Dolores (Plaza de Jesús, 4) Best cañas in Madrid. Nothing more to say HOMEMADE SPANISH FOOD Viuda de vacas (Calle Águila, 23) It is amazing to try real food from Madrid, the most ""castizo"" you will find. Try “Potaje de garbanzos con espinacas”, “callos a la madrileña”, “gallina en pepitoria”, “jamón asado” y “lomo alto” and boletus when season. Casa Perico (Calle Ballesta, 18) c (Website hidden by Airbnb)  Across Gran Vía you will find this traditional restaurant. Any dish you choose will not disappoint. Casa Ciriaco (Calle Mayor, 84) Traditional ",PLEASE NOTICE that check in after 8pm and before 10pm require an extra cost of 20€. From 10pm to midnight 40€ and after midnight 60€ EARLY CHECK IN available upon request if there is no guests leaving the same day from 11am to 2pm 20€. From 7am to 9 am 60€. From 9am to 11am 40€.,"Metro: La Latina, line 5 (5 minutes away) Ópera, line 2, 5, R (10 minutes away) Bus: A lot of bus lines in the main street (Bailén) Walking! There are few places that you need to take public transportation to get them",All the place is for your own use,"We live just a few blocks away, so if you need us just call!","Late check in (since 10pm) extra charged with 20 euros payable at the arrival Smokers not allowed Parties not allowed Pets not allowed Está absolutamente y totalmente prohibido realizar fiestas o eventos en el apartamento, tampoco en las zonas comunes del edificio. Se ruega moderar el volumen de los aparatos electrónicos (reproductores de música, ordenadores y televisor...) a partir de las 11:00 pm. Por favor respeten el descanso de los vecinos, y la convivencia pacífica. El incumplimiento de estas normas conllevará la cancelación de la reserva y la inmediata expulsión del apartamento. This is absolutely and totally forbidden to make parties and events in the apartment, also in the common areas of the building. Please moderate the volume of electronic equipment (TV, computers and music players ...) from 11:00 pm. Pray, respect the rest of the neighbors, and peaceful coexistence. Failure to comply with these rules will result in cancellation of the reservation and immediate expulsion fr",,,https://a0.muscache.com/im/pictures/aac4a0fc-46f7-4312-9f12-e4aef1e30b3d.jpg?aki_policy=large,,487095,https://www.airbnb.com/users/show/487095,Alicia Y Carlos,2011-04-05,"Madrid, Madrid, Spain","We are a couple from Madrid, we love travel and meet new people.
We both work at music business, representing and promoting bands.",within an hour,100%,N/A,f,https://a0.muscache.com/im/users/487095/profile_pic/1308578013/original.jpg?aki_policy=profile_small,https://a0.muscache.com/im/users/487095/profile_pic/1308578013/original.jpg?aki_policy=profile_x_medium,La Latina,1,1,"['email', 'phone', 'facebook', 'reviews', 'manual_offline', 'jumio', 'offline_government_id', 'selfie', 'government_id', 'identity_manual', 'work_email']",t,t,"Madrid, Madrid, Spain",Centro,Palacio,Centro,Madrid,Madrid,28005,Madrid,"Madrid, Spain",ES,Spain,40.41218,-3.71369,t,Loft,Entire home/apt,6,1.0,2,3,Real Bed,"{TV,""Cable TV"",Wifi,""Air conditioning"",Kitchen,Elevator,Heating,""Family/kid friendly"",Washer,""Smoke detector"",""First aid kit"",""Fire extinguisher"",Essentials,Shampoo,Hangers,""Hair dryer"",Iron,""Laptop friendly workspace"",""translation missing: en.hosting_amenity_50"",""High chair"",""Children’s books and toys"",Crib,""Hot water"",""Luggage dropoff allowed"",""Long term stays allowed"",""Host greets you"",""Paid parking on premises""}",646,$110.00,$600.00,,$200.00,$89.00,4,$20.00,2,30,2,3,30,30,2.3,30.0,today,t,14,30,31,292,2019-09-19,195,20,2011-07-01,2019-09-15,96,10,9,10,10,10,9,t,VT 3441,,t,f,strict_14_with_grace_period,f,f,1,1,0,0,1.95
