70059,https://www.airbnb.com/rooms/70059,20190919050215,2019-09-19,"PLAZA ESPAÑA/Wifi/ downtown /parking. Cozy, Bright","Nice, cozy and very bright apartment, just in the city center of Madrid, equipped with all the home comforts: lift, lounge, kitchen, bathroom, TV, free internet access and a balcony overlooking the square, a great location, you'll love it.","Nice and cozy, very bright, just the city center of Madrid, in a historic building of urban protection (1987, fully restored), equipped with all the comforts of home (elevator, lounge, kitchen, bathroom, flat TV , free internet access WIFI, ...). With  balcony overlooking to small square, an excellent area. Apartment 2 people, Living area 34 m2, 1 living room, 1 dining-room, kitchen, bathroom with shower. Date of construction: 1875, Date of last renovation: 2004.","Nice, cozy and very bright apartment, just in the city center of Madrid, equipped with all the home comforts: lift, lounge, kitchen, bathroom, TV, free internet access and a balcony overlooking the square, a great location, you'll love it. Nice and cozy, very bright, just the city center of Madrid, in a historic building of urban protection (1987, fully restored), equipped with all the comforts of home (elevator, lounge, kitchen, bathroom, flat TV , free internet access WIFI, ...). With  balcony overlooking to small square, an excellent area. Apartment 2 people, Living area 34 m2, 1 living room, 1 dining-room, kitchen, bathroom with shower. Date of construction: 1875, Date of last renovation: 2004. Cleaning service € 20, not included in the price. For those who travel by car or rent, we have parking space (price to be agreed). Whenever they need. We meet the arrival day in order to give them all the information about the house and the neighborhood. And if they want so, we will only mee",none,"The location of this apartment is ideal for walking the city's most significant tourist and historical sites of Madrid. Beautiful places like the Plaza of Spain, the Plaza del Callao, Opera, Plaza Mayor, Puerta del Sol,... Stunning streets are only 1 minute: Gran Via and Calle de la Princesa, full of cinemas, theaters, shops and restaurants. Or the street Preciados with many prestigious shops, bars with terraces and lots of entertainment. Visit the main museums like El Prado, Thyssen and Reina Sofia and the Royal Palace. Another option is to take a bus that does tours of the city. Only 200 m. begins the Plaza of Spain, which is the gateway to the largest green area of Madrid. To his left are the 2 gardens of the Royal Palace: ""Sabatini"" and ""Campo del Moro"", and right there is the ""Temple of Debod"" and ""West Park"", where you can take the cable car from which is a view of Madrid from above, through the ""Casa de Campo"" .","For those traveling by car or rent, we have a garage (price to be agreed).","You can walk to all places. But if you need public transport, there are 3 tube lines next to apartment. At 10 meters of apartment entrance there is an elevator direct access to the Metro (tube) station ""Plaza of Spain."" to go directly to the Madrid-Barajas Airport (35 minutes).  Just as it is convenient and fast access to the fairgrounds ""IFEMA Juan Carlos I"", metro ""Campo de las Naciones"" where all exposures, convection, fairs and congresses are held in the capital.  Direct underground connections to the train stations ""Atocha"" and ""Chamartín""  Parkings, Taxis, buses and everything :)","Cleaning service € 20, not included in the price. For those who travel by car or rent, we have parking space (price to be agreed).","Whenever they need. We meet the arrival day in order to give them all the information about the house and the neighborhood. And if they want so, we will only meet again the departure day. In any case, I will always be available via phone or in person for any questions or concerns.","Fee cleaning 20€ cash. - The LESSOR rents the apartment to the LESSEE, for the duration of the contract and number people stated. Check out time is 12:00 noon. - ARE NOT ALLOWED (except with the express knowledge and consent of the lessor): BUSINESS, PARTIES.  Excessive noise and scandalous behaviour are prohibited.  - LESSEE must leave the apartment in the same condition it was received. Infraction of these basic rules will lead to immediate termination of the contract and expulsion from the apartment with no rights to reclaim money paid.",,,https://a0.muscache.com/im/pictures/6479679/b14b9a98_original.jpg?aki_policy=large,,353616,https://www.airbnb.com/users/show/353616,Diana,2011-01-19,"Madrid, Community of Madrid, Spain","Para mi lo importante son las personas.
Me encanta viajar a lugares y culturas diferentes.  Soy actriz e instructora de yoga.
Y Espero conocerte pronto.",within a few hours,100%,N/A,f,https://a0.muscache.com/im/users/353616/profile_pic/1295465186/original.jpg?aki_policy=profile_small,https://a0.muscache.com/im/users/353616/profile_pic/1295465186/original.jpg?aki_policy=profile_x_medium,Malasaña,3,3,"['email', 'phone', 'reviews', 'offline_government_id', 'selfie', 'government_id']",t,f,"Madrid, Community of Madrid, Spain",Centro,Universidad,Centro,Madrid,Community of Madrid,28015,Madrid,"Madrid, Spain",ES,Spain,40.42365,-3.70889,t,Apartment,Entire home/apt,2,1.0,1,1,Real Bed,"{TV,Wifi,""Air conditioning"",Kitchen,""Paid parking off premises"",Elevator,""Buzzer/wireless intercom"",Heating,Washer,""Smoke detector"",Essentials,Shampoo,""24-hour check-in"",Hangers,""Hair dryer"",Iron,""Laptop friendly workspace"",""translation missing: en.hosting_amenity_49"",""translation missing: en.hosting_amenity_50"",""Hot water"",""Bed linens"",Microwave,""Coffee maker"",Refrigerator,""Dishes and silverware"",""Cooking basics"",Stove,""Host greets you"",""Paid parking on premises""}",,$65.00,$399.00,"$1,100.00",$150.00,,1,$0.00,5,365,5,5,365,365,5.0,365.0,a week ago,t,1,2,16,291,2019-09-19,85,19,2011-02-23,2019-09-16,97,10,10,10,10,10,9,t,VT-7440,,f,f,moderate,f,f,2,2,0,0,0.81
70310,https://www.airbnb.com/rooms/70310,20190919050215,2019-09-19,"Heart of Malasaña Cozy, Quiet & Sunny Apartment",Cozy Apartment in great location in the center of Madrid at a great price! You will be able to visit all Madrid on foot!,"Great location and comfort is what you'll find in this nice apartment with high ceilings and large windows overlooking the quiet courtyard with no street noise . The apartment is a cozy apartment with different spaces: the living room has a sofa bed type lounge which becomes a wide double bed for 2 people, TV,  table dining room that opens for up to 4 people can eat !. The kitchen is open to living and has washing machine, microware, dishwasher and big fridge, and all the appliances and utensils necessary. The bedroom is very quiet and bright, it has a large window (balcony type) wood and has two single beds, large wardrobe and a practical rack. The bathroom has a shower, sink and toilet and the kitchen is fully equipped with everything needed for a comfortable stay in Madrid. The equipment includes: - Free Internet Connection by Optical Fibre - Individual Heating - TV - DVD - Stereo with CD The kitchen is equipped with all necessary utensils and appliances : - Washing machine - Dishwa","Cozy Apartment in great location in the center of Madrid at a great price! You will be able to visit all Madrid on foot! Great location and comfort is what you'll find in this nice apartment with high ceilings and large windows overlooking the quiet courtyard with no street noise . The apartment is a cozy apartment with different spaces: the living room has a sofa bed type lounge which becomes a wide double bed for 2 people, TV,  table dining room that opens for up to 4 people can eat !. The kitchen is open to living and has washing machine, microware, dishwasher and big fridge, and all the appliances and utensils necessary. The bedroom is very quiet and bright, it has a large window (balcony type) wood and has two single beds, large wardrobe and a practical rack. The bathroom has a shower, sink and toilet and the kitchen is fully equipped with everything needed for a comfortable stay in Madrid. The equipment includes: - Free Internet Connection by Optical Fibre - Individual Heating - ",none,"Located in the heart of Malasaña,  2 minutes from the Gran Via Avenue and near Chueca, the gay quarter of Madrid, it is also where you will find a vibrant night life, and exciting shopping streets. This lively cultural hub of Madrid is simply teeming with every kind of restaurant, bar, club and shop you would want or need. The Apartments Malasaña 1 and 2 (which are together in the same building and floor) are perfect for anyone who wants to know and enjoy Madrid. Located in a renovated historic building next to the Gran Via and Puerta del Sol and near Chueca and Malasaña, are within walking distance of everything, so you can visit Madrid on foot.  This apartment located in the heart of Madrid has all the amenities to make your stay as comfortable and you feel at home.","","If desired, you can use the subway or bus, but need not, for you are in the center of Madrid and you can move on foot!  The nearest metro station: Gran Via (lines 1 and 5).  Also nearby: Tribunal, Chueca, Callao, etc.","You have all the apartment for you. You also have free wifi internet connection, and you can choose the temperature by the air conditioning and heating.","When you arrive, you will be waiting at the apartment to give you the keys and explain how everything works and inform you of shops and supermarkets nearby.  And do not bother you anymore! We want you to have complete independence and respect your privacy  unless you need us for something!  You will have our phone to help you solve any problems you may have during your stay in Madrid.","CHECK IN/OUT At least 3 days before date of arrival, must be sent by email the details of your arrival (flight number and / or estimated time of arrival). Also, on arrival date, must call the contact person (whose phone was provided in email booking confirmation) from the airport, once you have collected your luggage, to confirm the meeting time in the apartment. If driving, you should call the contact person at least one hour before the scheduled time of arrival.  Check-in time: from 15:00h to 20:00h. Check-in earlier is only available depending on apartment’s availability (if there are guests hosted the night before). Check-out time : from 09:00h to 11:00h Check-in/out beyond standard schedule:  From 20:00h to 24:00h ￫ 30 € From 24:00h to 07:00h ￫ 50 €  From 07:00h to 09:00h ￫ 30 € CLEANING: The apartment is cleaned prior to your arrival. The day of departure you must leave the apartment tidy and reasonably clean. (kitchenware and kitchen clean and tidy, and no garbage in the apartme",,,https://a0.muscache.com/im/pictures/88042438/5e75e023_original.jpg?aki_policy=large,,353738,https://www.airbnb.com/users/show/353738,Raquel,2011-01-19,"Madrid, Community of Madrid, Spain","Hola, 
Me encanta viajar y conocer gente de otras culturas y costumbres. Por eso disfruto alojando a personas de otros paises y lugares que me permiten ampliar mi visión del mundo. ",within an hour,100%,N/A,f,https://a0.muscache.com/im/pictures/user/09dc8a1d-f649-4a6c-a0dd-1bb89d880fd4.jpg?aki_policy=profile_small,https://a0.muscache.com/im/pictures/user/09dc8a1d-f649-4a6c-a0dd-1bb89d880fd4.jpg?aki_policy=profile_x_medium,Malasaña,5,5,"['email', 'phone', 'reviews', 'jumio', 'offline_government_id', 'government_id', 'work_email']",t,t,"Madrid, Madrid, Spain",Centro,Universidad,Centro,Madrid,Madrid,28004,Madrid,"Madrid, Spain",ES,Spain,40.42321,-3.70143,t,Apartment,Entire home/apt,4,1.0,1,3,Real Bed,"{TV,Internet,Wifi,""Air conditioning"",Kitchen,""Paid parking off premises"",Heating,Washer,Essentials,Hangers,""Hair dryer"",Iron,""Laptop friendly workspace"",""translation missing: en.hosting_amenity_49"",""translation missing: en.hosting_amenity_50"",""Hot water"",Microwave,""Coffee maker"",Refrigerator,Dishwasher,""Dishes and silverware"",""Cooking basics"",Stove,""Long term stays allowed"",""Host greets you"",""Paid parking on premises""}",,$70.00,$399.00,"$1,302.00",$500.00,$50.00,2,$20.00,28,360,28,28,360,360,28.0,360.0,4 weeks ago,t,8,38,68,343,2019-09-19,18,5,2011-05-03,2019-05-19,82,9,9,9,9,10,8,t,,,t,f,strict_14_with_grace_period,t,f,5,5,0,0,0.18
70315,https://www.airbnb.com/rooms/70315,20190919050215,2019-09-19,Superbly located 2 bedrooms 2 balconies,"Bonito apartamento con dos dormitorios, cada uno de ellos con un balcón a la calle con vistas a la Plaza de España. Situación prefecta para descubrir Madrid a fondo! Importante!: Actualmente el apartamento tiene un dormitorio con cama doble y otro dormitorio con dos camas individuales, por tanto es perfecto para 3 personas si quieren dormir cada uno en una cama o para 4 personas si dos quieren compartir cama.","Este apartamento destaca por su excelente ubicación en el centro de Madrid: todo Madrid al alcance de tu mano, sin necesidad de usar el transporte público, si no lo deseas. El apartamento es muy luminoso, con dos balcones a la calle desde donde puedes ver la famosa torre de la Plaza de España. Importante!: Actualmente el apartamento tiene un dormitorio con cama doble y otro dormitorio con dos camas individuales, por tanto es perfecto para 3 personas si quieren dormir cada uno en una cama o para 4 personas si dos quieren compartir cama. El salón comparte espacio con la cocina que, aunque es pequeña, está bien equipada.  Internet wifi y aire acondicionado son otros puntos atractivos de este céntrico apartamento.","Bonito apartamento con dos dormitorios, cada uno de ellos con un balcón a la calle con vistas a la Plaza de España. Situación prefecta para descubrir Madrid a fondo! Importante!: Actualmente el apartamento tiene un dormitorio con cama doble y otro dormitorio con dos camas individuales, por tanto es perfecto para 3 personas si quieren dormir cada uno en una cama o para 4 personas si dos quieren compartir cama. Este apartamento destaca por su excelente ubicación en el centro de Madrid: todo Madrid al alcance de tu mano, sin necesidad de usar el transporte público, si no lo deseas. El apartamento es muy luminoso, con dos balcones a la calle desde donde puedes ver la famosa torre de la Plaza de España. Importante!: Actualmente el apartamento tiene un dormitorio con cama doble y otro dormitorio con dos camas individuales, por tanto es perfecto para 3 personas si quieren dormir cada uno en una cama o para 4 personas si dos quieren compartir cama. El salón comparte espacio con la cocina que, ",none,"AREA WHERE IS THE APARTMENT  The street where the apartment is located in the downtown district, the Barrio de Palacio, one of the most popular areas of the city center, as it has all the amenities and very good communication with all areas of Madrid. Very close to the Gran Via and Puerta del Sol, Madrid can enjoy on foot, without using public transportation.  Also within walking distance is the Gran Via, full of designer shops and theaters, also called Madrid's Broadway, and from there you will reach the Puerta del Sol in a moment.  From Puerta del Sol, a few minutes you reach the Royal Palace, Madrid de los Austrias and the Plaza Mayor. And also to the Barrio de las Letras and the Prado, Thyssen and Reina Sofia.  The Paseo de la Castellana and the Plaza de Cibeles are a 15 minute walk from the apartment, and the Retiro Park is less than 20 minutes.  The trendiest neighborhoods of Madrid, Chueca and Malasaña, are also within 5 minutes walk. The Plaza 2 de Mayo, famous for its terraces",Las fiestas no están permitidas.,"If desired, you can use the subway or bus, but need not, for you are in the center of Madrid and you can move on foot!  The nearest metro station: Plaza de España.  Also nearby: Santo Domingo, Noviciado, Callao, Gran Via, etc.","All the apartment, fully equipped: features:  - Air Conditioning & Heating  - Internet wifi  - Kitchen with all appliances  - Bed linen and towels  - TV - Elevator","When you arrive, you will be waiting at the apartment to give you the keys and explain how everything works and inform you of shops and supermarkets nearby.  And do not bother you anymore! We want you to have complete independence and respect your privacy  unless you need us for something!  You will have our phone to help you solve any problems you may have during your stay in Madrid.","CHECK IN/OUT At least 3 days before date of arrival, must be sent by email the details of your arrival (flight number and / or estimated time of arrival). Also, on arrival date, must call the contact person (whose phone was provided in email booking confirmation) from the airport, once you have collected your luggage, to confirm the meeting time in the apartment. If driving, you should call the contact person at least one hour before the scheduled time of arrival.  Check-in time: from 15:00h to 20:00h. Check-in earlier is only available depending on apartment’s availability (if there are guests hosted the night before). Check-out time : from 09:00h to 11:00h Check-in/out beyond standard schedule:  From 20:00h to 24:00h ￫ 30 € From 24:00h to 07:00h ￫ 50 €  From 07:00h to 09:00h ￫ 30 € CLEANING: The apartment is cleaned prior to your arrival. The day of departure you must leave the apartment tidy and reasonably clean. (kitchenware and kitchen clean and tidy, and no garbage in the apartme",,,https://a0.muscache.com/im/pictures/8f23b673-cc6a-40db-8683-87f9ee26e568.jpg?aki_policy=large,,353738,https://www.airbnb.com/users/show/353738,Raquel,2011-01-19,"Madrid, Community of Madrid, Spain","Hola, 
Me encanta viajar y conocer gente de otras culturas y costumbres. Por eso disfruto alojando a personas de otros paises y lugares que me permiten ampliar mi visión del mundo. ",within an hour,100%,N/A,f,https://a0.muscache.com/im/pictures/user/09dc8a1d-f649-4a6c-a0dd-1bb89d880fd4.jpg?aki_policy=profile_small,https://a0.muscache.com/im/pictures/user/09dc8a1d-f649-4a6c-a0dd-1bb89d880fd4.jpg?aki_policy=profile_x_medium,Malasaña,5,5,"['email', 'phone', 'reviews', 'jumio', 'offline_government_id', 'government_id', 'work_email']",t,t,"Madrid, Madrid, Spain",Palacio,Palacio,Centro,Madrid,Madrid,28013,Madrid,"Madrid, Spain",ES,Spain,40.42138,-3.71101,t,Apartment,Entire home/apt,4,1.0,2,3,Real Bed,"{TV,Internet,Wifi,""Air conditioning"",Kitchen,""Paid parking off premises"",Heating,Washer,Essentials,Hangers,Iron,""Laptop friendly workspace"",""translation missing: en.hosting_amenity_49"",""translation missing: en.hosting_amenity_50"",""Hot water"",""Bed linens"",Microwave,""Coffee maker"",Refrigerator,""Dishes and silverware"",""Cooking basics"",Stove,""Patio or balcony"",""Long term stays allowed"",""Host greets you"",""Paid parking on premises""}",,$75.00,$553.00,"$1,953.00",$300.00,$70.00,2,$10.00,28,360,28,28,360,360,28.0,360.0,7 weeks ago,t,0,18,48,323,2019-09-19,3,0,2013-06-04,2016-06-01,80,7,7,9,8,9,8,t,,,t,f,strict_14_with_grace_period,t,f,5,5,0,0,0.04
70316,https://www.airbnb.com/rooms/70316,20190919050215,2019-09-19,Superbly located Monthly rental Bills Incl.,"Spacious two bedroom apartment fully equipped and superbly located at Plaza de España-Gran Via within a walking distance to Malasana, Royal Palace, Puerta del Sol, Mayor Square, etc Also, very close to ICADE, IE, Universidad Complutense, etc. Excellent transport links with all the areas and universities. Perfect for discovering Madrid on foot.","This perfectly pleasant rental apartment is a winner if you want cosy and centrality. Set in one of Gran Vía's best spots for getting around the city, the Plaza de Espana II apartment makes a fine self-catering choice for all of your Madrid ambitions. It has 2 bedrooms, one with a double bed and the other one with one single bed. The living/dining room has dining table, TV,  and a comfortable sofa. A small kitchen is at one end of the common room and is equipped with a washing machine, fridge, electric stove top, microwave and a full set of dishware. The large bathroom has style and a shower. The temperature can be adjusted with heating and air conditioning. Free high speed ADSL Wi-Fi Internet connection is also available to guests. Important to know: the Gran Via Plaza de Spain 2 apartment is next to the Gran Via Plaza de Spain 1 apartment, an excellent choice for bigger groups of both family, friends or businesses. The apartment is located in the prestigious Gran Via area of central ","Spacious two bedroom apartment fully equipped and superbly located at Plaza de España-Gran Via within a walking distance to Malasana, Royal Palace, Puerta del Sol, Mayor Square, etc Also, very close to ICADE, IE, Universidad Complutense, etc. Excellent transport links with all the areas and universities. Perfect for discovering Madrid on foot. This perfectly pleasant rental apartment is a winner if you want cosy and centrality. Set in one of Gran Vía's best spots for getting around the city, the Plaza de Espana II apartment makes a fine self-catering choice for all of your Madrid ambitions. It has 2 bedrooms, one with a double bed and the other one with one single bed. The living/dining room has dining table, TV,  and a comfortable sofa. A small kitchen is at one end of the common room and is equipped with a washing machine, fridge, electric stove top, microwave and a full set of dishware. The large bathroom has style and a shower. The temperature can be adjusted with heating and air c",none,"AREA WHERE IS THE APARTMENT  The street where the apartment is located in the downtown district, the Barrio de Palacio, one of the most popular areas of the city center, as it has all the amenities and very good communication with all areas of Madrid. Very close to the Gran Via and Puerta del Sol, Madrid can enjoy on foot, without using public transportation.  Also within walking distance is the Gran Via, full of designer shops and theaters, also called Madrid's Broadway, and from there you will reach the Puerta del Sol in a moment.  From Puerta del Sol, a few minutes you reach the Royal Palace, Madrid de los Austrias and the Plaza Mayor. And also to the Barrio de las Letras and the Prado, Thyssen and Reina Sofia.  The Paseo de la Castellana and the Plaza de Cibeles are a 15 minute walk from the apartment, and the Retiro Park is less than 20 minutes.  The trendiest neighborhoods of Madrid, Chueca and Malasaña, are also within 5 minutes walk. The Plaza 2 de Mayo, famous for its terraces",Parties are not allowed,"If desired, you can use the subway or bus, but need not, for you are in the center of Madrid and you can move on foot!  The nearest metro station: Plaza de España.  Also nearby: Santo Domingo, Noviciado, Callao, Gran Via, etc.","You have all the apartment for you. You also have free wifi internet connection, and you can choose the temperature by the air conditioning and heating.","When you arrive, you will be waiting at the apartment to give you the keys and explain how everything works and inform you of shops and supermarkets nearby.  And do not bother you anymore! We want you to have complete independence and respect your privacy  unless you need us for something!  You will have our phone to help you solve any problems you may have during your stay in Madrid.","CHECK IN/OUT At least 3 days before date of arrival, must be sent by email the details of your arrival (flight number and / or estimated time of arrival). Also, on arrival date, must call the contact person (whose phone was provided in email booking confirmation) from the airport, once you have collected your luggage, to confirm the meeting time in the apartment. If driving, you should call the contact person at least one hour before the scheduled time of arrival.  Check-in time: from 15:00h to 20:00h. Check-in earlier is only available depending on apartment’s availability (if there are guests hosted the night before). Check-out time : from 09:00h to 11:00h Check-in/out beyond standard schedule:  From 20:00h to 24:00h ￫ 30 € From 24:00h to 07:00h ￫ 50 €  From 07:00h to 09:00h ￫ 30 € CLEANING: The apartment is cleaned prior to your arrival. The day of departure you must leave the apartment tidy and reasonably clean. (kitchenware and kitchen clean and tidy, and no garbage in the apartme",,,https://a0.muscache.com/im/pictures/a1191fb3-9a0c-491a-acf1-d50358607ce7.jpg?aki_policy=large,,353738,https://www.airbnb.com/users/show/353738,Raquel,2011-01-19,"Madrid, Community of Madrid, Spain","Hola, 
Me encanta viajar y conocer gente de otras culturas y costumbres. Por eso disfruto alojando a personas de otros paises y lugares que me permiten ampliar mi visión del mundo. ",within an hour,100%,N/A,f,https://a0.muscache.com/im/pictures/user/09dc8a1d-f649-4a6c-a0dd-1bb89d880fd4.jpg?aki_policy=profile_small,https://a0.muscache.com/im/pictures/user/09dc8a1d-f649-4a6c-a0dd-1bb89d880fd4.jpg?aki_policy=profile_x_medium,Malasaña,5,5,"['email', 'phone', 'reviews', 'jumio', 'offline_government_id', 'government_id', 'work_email']",t,t,"Madrid, Community of Madrid, Spain",Palacio,Palacio,Centro,Madrid,Community of Madrid,28013,Madrid,"Madrid, Spain",ES,Spain,40.42111,-3.7101,t,Apartment,Entire home/apt,3,1.0,2,2,Real Bed,"{TV,Internet,Wifi,""Air conditioning"",Kitchen,""Paid parking off premises"",Heating,Washer,Essentials,Hangers,""Hair dryer"",Iron,""Laptop friendly workspace"",""translation missing: en.hosting_amenity_49"",""translation missing: en.hosting_amenity_50"",""Hot water"",""Bed linens"",Microwave,""Coffee maker"",Refrigerator,""Dishes and silverware"",""Cooking basics"",Stove,""Long term stays allowed"",""Host greets you"",""Paid parking on premises""}",,$75.00,$420.00,"$1,323.00",$500.00,$60.00,2,$10.00,28,360,28,28,360,360,28.0,360.0,7 weeks ago,t,0,0,0,261,2019-09-19,6,1,2015-06-28,2019-01-02,77,8,8,8,8,9,9,t,,,t,f,strict_14_with_grace_period,t,f,5,5,0,0,0.12
